{
  "protocolVersion": 1,
  "jobId": "22222222-2222-4222-8222-222222222222",
  "createdAt": "2026-09-05T12:00:00.000+09:00",
  "course": {
    "id": "11111111-1111-4111-8111-111111111111",
    "name": "운영체제",
    "professorName": ""
  },
  "source": {
    "fileName": "1주차.m4a",
    "mediaType": "audio"
  },
  "summaryMode": "standard"
}
